{
  "name": "Colorado Ski Country",
  "slug": "colorado-ski",
  "description": "World-class ski resorts, mountain lodges, and après-ski culture in the Rockies — from Breckenridge to Vail with summer hiking and biking too.",
  "scope": "us",
  "center": { "lat": 39.48, "lng": -106.05 },
  "zoom": 9
}
